{
  "engine": "cocos",
  "local_run": "conditional",
  "headless_run": "conditional",
  "build": "conditional",
  "static_audit": "available",
  "ci_required": [
    "cli_build_plan",
    "editor_assisted_smoke",
    "publish_target_build"
  ],
  "manual_checks": [
    "scene_preview_smoke",
    "asset_swap_smoke"
  ],
  "content_modes": [
    "2d",
    "3d",
    "mixed"
  ],
  "publish_targets": [
    "web-mobile",
    "web-desktop",
    "wechatgame"
  ]
}
