{
  "engine": "unity",
  "local_run": "conditional",
  "headless_run": "conditional",
  "build": "conditional",
  "static_audit": "available",
  "ci_required": [
    "compile",
    "editmode_tests",
    "player_build"
  ],
  "manual_checks": [
    "scene_playtest",
    "avatar_swap_smoke"
  ],
  "content_modes": [
    "3d"
  ],
  "publish_targets": [
    "web-desktop"
  ]
}
